{
  "schema": "firstcall.programmeA.a1_registration_record.v1",
  "component_id": "R17",
  "component": "SPEC_PARSER",
  "status": "REGISTERED_PENDING_ANCHOR",
  "artifact": {
    "implementation": "experiments/programme-a/a1/registrations/a1_spec_parser.py",
    "parser_id": "firstcall-a1-spec-parser",
    "parser_version": "1.2.1",
    "yaml": "PyYAML 6.0.3 pure-Python SafeLoader, vendored byte-identically from the PyPI sdist (sdist sha256 d76623373421df22fb4cf8817020cbb7ef15c725b9d5e45f17e189bfc384190f, MIT); libyaml forbidden",
    "json": "stdlib json; duplicate keys and NaN/Infinity rejected",
    "anchored_dependencies": {
      "a1_evidence.py": "frozen field selection/default substitution only",
      "a1_frame.py": "historical byte-preserved source of sampling design"
    },
    "rules": {
      "input": "one primary-entry file; .json -> JSON, .yaml -> YAML; <= 64 MiB; one leading UTF-8 BOM stripped; strict UTF-8",
      "fail_closed": [
        "UNSUPPORTED_FILE_TYPE",
        "INPUT_TOO_LARGE",
        "INVALID_UTF8",
        "JSON_INVALID",
        "YAML_INVALID",
        "DUPLICATE_KEY",
        "NON_FINITE_NUMBER",
        "NOT_EXACTLY_ONE_DOCUMENT",
        "ALIAS_LIMIT (>10000)",
        "TOO_DEEP (nesting > 1000, iterative check; or RecursionError)",
        "YAML_CONSTRUCTOR_ERROR",
        "ROOT_NOT_MAPPING",
        "DOCUMENT_INVALID",
        "NOT_AN_A1_RAW_ENTRY_PATH",
        "CYCLIC_ALIAS -> DOCUMENT_INVALID",
        "PYTHON_EQUAL_YAML_KEYS -> DUPLICATE_KEY",
        "YAML_NAN_OR_OVERFLOW -> NON_FINITE_NUMBER"
      ],
      "fail_closed_consequence": "PARSE_FAILED record with no E2 leads; predicates needing leads become UNRESOLVED (evidence insufficient)",
      "family": "OAS3 if openapi is a string starting '3.'; OAS2 if str(swagger) in ('2.0','2'); both -> AMBIGUOUS_OPENAPI_AND_SWAGGER; neither -> UNRECOGNISED_VERSION (recorded; leads still computed exactly as the anchored function does)",
      "servers": "root-level servers only (anchored E2 fields); path/operation servers ignored and counted",
      "swagger": "anchored behaviour: scheme+host+basePath for every listed scheme, 'https' if schemes absent",
      "url_rules": "Freeze 1.2.1 normalise_lead; shared strict IDNA2008 host primitive; terminal slash run removed once",
      "host_rdg": "Freeze 1.2.1 a1_frame_121; shared host primitive; frozen structural sampling otherwise unchanged",
      "output": "canonical JSON (sorted keys, compact, ensure_ascii=false); leads sorted and de-duplicated; dropped candidates sorted by canonical JSON",
      "d8_annotation": "Historical conformance annotations retained as diagnostics; repaired E2 output must have none"
    },
    "operative_dependencies": [
      "a1_frame_121.py",
      "a1_e2_leads.py",
      "a1_host.py",
      "a1_integrity_121.py"
    ]
  },
  "version": "1.2.1",
  "digests": {
    "a1_spec_parser.py": "e7f80765df2ae7fab3304e350b16b0224e6238ffae0a0eb33beb472ddd2985be",
    "vendored_pyyaml": {
      "vendor/pyyaml-6.0.3/LICENSE": "8d3928f9dc4490fd635707cb88eb26bd764102a7282954307d3e5167a577e8a4",
      "vendor/pyyaml-6.0.3/yaml/__init__.py": "b19dfcc333d6a75dfd73073901164507252f271b41d3b5f7d85510033a0547a7",
      "vendor/pyyaml-6.0.3/yaml/composer.py": "fcaa37d16afa783594794a5ab94193dcb720f503c19ce3d59539c8311189f453",
      "vendor/pyyaml-6.0.3/yaml/constructor.py": "90d8247da78b524c10618fd0e857f54f3d97570fe91b5c5513d024ef3faf88b0",
      "vendor/pyyaml-6.0.3/yaml/cyaml.py": "e99ac01bd7c062f7557b614aff0d21997a06ed962ca185306a91bc0a20bbd87d",
      "vendor/pyyaml-6.0.3/yaml/dumper.py": "3cb72d66563064ba7b5e679477046ebf89d8399d940670c8532f3e94a7cb17ea",
      "vendor/pyyaml-6.0.3/yaml/emitter.py": "8e086d694ede170837d5b1b407b45979aff6f40762f422a65eafd08e04290a44",
      "vendor/pyyaml-6.0.3/yaml/error.py": "021f73fada072546c4f63f8cf18a7181244ce4280b09cc15cc980b2d1176171a",
      "vendor/pyyaml-6.0.3/yaml/events.py": "e74fd392c810884e2ea7e94aa3f57e9c1cbeb402319083d0c58e6a0e1282787c",
      "vendor/pyyaml-6.0.3/yaml/loader.py": "5156becc8aa6905482218abf3e04869b835226db4763645fff3438fdbd5f1cdd",
      "vendor/pyyaml-6.0.3/yaml/nodes.py": "80f28d8fca4a09d87677882bde021820d9cf39a3b11a12405226211919cf13ce",
      "vendor/pyyaml-6.0.3/yaml/parser.py": "8a55a9e6fbe0a07146cef3990c8b45a068c3e83e369e1959ad9ca30306b4a09a",
      "vendor/pyyaml-6.0.3/yaml/reader.py": "d1d9b38ab3a20c6e17a38d519ee412ecaf6b918df18c78956ac7c330d4ea08dc",
      "vendor/pyyaml-6.0.3/yaml/representer.py": "22e58ff9c016f6c1ca1274b4802a926bcf78935060e1c813c5a0f021c6d143e6",
      "vendor/pyyaml-6.0.3/yaml/resolver.py": "f4bf9561f9b89961f1503d558385fbae30d12bfed565de9bf76c33abb63620a6",
      "vendor/pyyaml-6.0.3/yaml/scanner.py": "60433788b652690c17710460da5d91e0c753d3318fd85f5e1e42862a71f25906",
      "vendor/pyyaml-6.0.3/yaml/serializer.py": "0a1b85826854d35863e31808f0668abfabdf33606e8f06bd8bb7761401e3edc0",
      "vendor/pyyaml-6.0.3/yaml/tokens.py": "953408cd2570f0c83dc2fe39f7e4e388e41eeb05738aa69196a5f6ffcf6ba79e"
    },
    "anchored_a1_evidence.py": "dc9fd2a1d6424c73bc0a19d40641b819164275e79ab60398f35731cc7a9c7426",
    "anchored_a1_frame.py": "2b89548735028561bebadfadac694bacf190d86ba4d3ee81570ebf93f3f57ef3",
    "pinned_psl": "a26f7d7e334778ed69216cedb5451ef82031feba6615c12039783cdd94e1fcae",
    "operative": {
      "a1_frame_121.py": "c7b1806113a3d894ae7dbb55ae3672d1b7f99b86e65c493bcb34a21ca8f54179",
      "a1_e2_leads.py": "6d03bbb0597d6c67f0cc93c96ac0eb4fc8438091270dcd6347e8101eb7957f6d",
      "a1_host.py": "7a273b62c8746d03007cd28afb8f45a6017e9a2d9213a4eed2a5720a117e4552",
      "a1_integrity_121.py": "00de65a8983161bb6d350128d3d84b619572a619f2d213b3513632e50e8dffb9"
    }
  },
  "registered_utc": "2026-09-19T00:11:22Z",
  "controlling_clause": "Freeze-1.2 A1 roles.json R17 SPEC_PARSER; decision-protocol.json navigation.spec_parser and evidence_hierarchy.E2; amendment §9; Freeze 1.2.1 D8A/D8B",
  "prerequisites": [
    "RT-A1-RUNTIME",
    "R18 pinned PSL (anchored)",
    "Freeze 1.2.1 shared IDNA2008 and additive integrity manifest"
  ],
  "required_before": "G4_SCREENING",
  "conditions": [],
  "conflicts_independence": "none (machine)",
  "registrant": {
    "kind": "machine_registration",
    "name": "prepared in the pre-reveal registration task"
  },
  "binding": "Binding only when committed, annotated-tagged programme-a-freeze-1.2.1-pre-reveal and pushed; G1 remains on HOLD in this task.",
  "immutability": "immutable after anchoring; any change requires re-registration before G4 (and a prospective amendment if E2 semantics change)",
  "anchor_parent": {
    "commit": "3def4227285453c253e2c6df969bb3eefc291fa8",
    "tag": "programme-a-freeze-1.2-a1"
  },
  "amendment": "Freeze 1.2.1"
}
